{
  "record_id": "der-00013",
  "record_type": "DER",
  "schema_version": "0.1.0",
  "timestamp": "2026-08-25T11:45:08Z",
  "request_context": {
    "request_id": "req-00013",
    "request_type": "CUSTOMER_OFFBOARDING",
    "requested_at": "2026-06-12T19:02:49Z",
    "requesting_role": "customer_admin",
    "requesting_organization_ref": "org-ref-74f4fd"
  },
  "data_scope": {
    "data_category": "vendor_contract_record",
    "subject_ref": "subject-ref-102cffe",
    "scope_description": "SaaS customer offboarding scenario — synthetic record for dataset testing purposes only.",
    "systems_in_scope": [
      "saas-app-support-01",
      "saas-app-billing-01"
    ],
    "processors_in_scope": [
      "subprocessor-analytics-01"
    ]
  },
  "execution": {
    "execution_status": "PARTIAL",
    "executed_at": "2026-08-23T23:43:39Z",
    "execution_method_declaration": "Deletion/data-exit executed via standard operational workflow declaration (synthetic).",
    "systems_completed": [
      "saas-app-support-01"
    ],
    "systems_pending": [
      "saas-app-billing-01"
    ]
  },
  "residual_state": {
    "backup_state": "backup purge pending next rotation cycle",
    "residual_copies_declared": false,
    "legal_hold": false,
    "subprocessor_status": "subprocessor deletion confirmed"
  },
  "evidence_metadata": {
    "source_system_id": "saas-app-support-01",
    "responsible_party_reference": "party-ref-49d7ea8",
    "recorded_at": "2026-08-25T11:45:08Z",
    "evidence_references": [
      "ticket-000013"
    ],
    "canonicalization_method": "der-ver-canonical-json-v0.1",
    "record_hash": "08e8a1a4374c340955b2cf0646487ea8ca01cd0a66c244e230108ca3744f8149"
  }
}
