{
  "record_id": "der-00253",
  "record_type": "DER",
  "schema_version": "0.1.0",
  "timestamp": "2026-08-25T14:28:24Z",
  "request_context": {
    "request_id": "req-00253",
    "request_type": "DATA_SUBJECT_REQUEST",
    "requested_at": "2026-06-29T21:34:56Z",
    "requesting_role": "procurement",
    "requesting_organization_ref": "org-ref-44e68ed"
  },
  "data_scope": {
    "data_category": "vendor_contract_record",
    "subject_ref": "subject-ref-41d778e",
    "scope_description": "Residual backup scenario — synthetic record for dataset testing purposes only.",
    "systems_in_scope": [
      "backup-system-offsite-02",
      "cloud-storage-archive-01",
      "cloud-storage-eu-02"
    ]
  },
  "execution": {
    "execution_status": "PARTIAL",
    "executed_at": "2026-08-14T01:06:22Z",
    "execution_method_declaration": "Deletion/data-exit executed via standard operational workflow declaration (synthetic).",
    "systems_completed": [
      "backup-system-offsite-02"
    ],
    "systems_pending": [
      "cloud-storage-archive-01",
      "cloud-storage-eu-02"
    ]
  },
  "residual_state": {
    "backup_state": "backup purge pending next rotation cycle",
    "residual_copies_declared": true,
    "retention_exception": "Residual copy identified in secondary storage tier (synthetic).",
    "legal_hold": false
  },
  "evidence_metadata": {
    "source_system_id": "backup-system-offsite-02",
    "responsible_party_reference": "party-ref-43e1878",
    "recorded_at": "2026-08-25T14:28:24Z",
    "evidence_references": [
      "ticket-000253"
    ],
    "canonicalization_method": "der-ver-canonical-json-v0.1",
    "record_hash": "61e15478e83f8bdf8bd22b79caf706a48ec403580b531bcfee277ce2715b5689"
  }
}
