{
  "record_id": "der-00231",
  "record_type": "DER",
  "schema_version": "0.1.0",
  "timestamp": "2026-08-26T00:28:53Z",
  "request_context": {
    "request_id": "req-00231",
    "request_type": "ADMINISTRATIVE_DELETION",
    "requested_at": "2026-07-26T21:53:45Z",
    "requesting_role": "data_subject",
    "requesting_organization_ref": "org-ref-4733bb7"
  },
  "data_scope": {
    "data_category": "vendor_contract_record",
    "subject_ref": "subject-ref-51f3b14",
    "scope_description": "Deletion exception scenario — synthetic record for dataset testing purposes only.",
    "systems_in_scope": [
      "analytics-warehouse-01",
      "crm-system-eu-02",
      "analytics-platform-02"
    ]
  },
  "execution": {
    "execution_status": "EXCEPTION",
    "executed_at": "2026-08-16T22:44:38Z",
    "execution_method_declaration": "Deletion/data-exit executed via standard operational workflow declaration (synthetic).",
    "systems_completed": [
      "analytics-warehouse-01"
    ],
    "systems_pending": [
      "crm-system-eu-02",
      "analytics-platform-02"
    ]
  },
  "residual_state": {
    "backup_state": "excluded from backup — primary system only",
    "residual_copies_declared": false,
    "legal_hold": false
  },
  "evidence_metadata": {
    "source_system_id": "analytics-warehouse-01",
    "responsible_party_reference": "party-ref-4ac90d6",
    "recorded_at": "2026-08-26T00:28:53Z",
    "evidence_references": [
      "ticket-000231"
    ],
    "canonicalization_method": "der-ver-canonical-json-v0.1",
    "record_hash": "03f6edbea2c4cc57d04f5c6046ef5af1667093c084e8de85c5519945bfd19c0b"
  }
}
