{
  "record_id": "der-00311",
  "record_type": "DER",
  "schema_version": "0.1.0",
  "timestamp": "2026-08-25T04:31:21Z",
  "request_context": {
    "request_id": "req-00311",
    "request_type": "VENDOR_EXIT",
    "requested_at": "2026-06-25T18:27:19Z",
    "requesting_role": "procurement",
    "requesting_organization_ref": "org-ref-1c27707"
  },
  "data_scope": {
    "data_category": "usage_analytics_record",
    "subject_ref": "subject-ref-42b7d44",
    "scope_description": "Vendor exit scenario — synthetic record for dataset testing purposes only.",
    "systems_in_scope": [
      "saas-app-support-01",
      "saas-app-core-01"
    ],
    "processors_in_scope": [
      "subprocessor-support-tooling-01"
    ]
  },
  "execution": {
    "execution_status": "EXCEPTION",
    "executed_at": "2026-08-10T10:54:36Z",
    "execution_method_declaration": "Deletion/data-exit executed via standard operational workflow declaration (synthetic).",
    "systems_completed": [
      "saas-app-support-01"
    ],
    "systems_pending": [
      "saas-app-core-01"
    ]
  },
  "residual_state": {
    "backup_state": "backup purge pending next rotation cycle",
    "residual_copies_declared": false,
    "legal_hold": false,
    "subprocessor_status": "subprocessor deletion confirmed"
  },
  "evidence_metadata": {
    "source_system_id": "saas-app-support-01",
    "responsible_party_reference": "party-ref-29023c6",
    "recorded_at": "2026-08-25T04:31:21Z",
    "evidence_references": [
      "ticket-000311"
    ],
    "canonicalization_method": "der-ver-canonical-json-v0.1",
    "record_hash": "6c33baadafd39bcbe354b3f9cd9f3c836eadb5c7a839f46db1c500bcd657c6cd"
  }
}
