{
  "record_id": "der-00199",
  "record_type": "DER",
  "schema_version": "0.1.0",
  "timestamp": "2026-08-25T12:41:31Z",
  "request_context": {
    "request_id": "req-00199",
    "request_type": "ACCOUNT_CLOSURE",
    "requested_at": "2026-07-07T20:54:20Z",
    "requesting_role": "hr_operations",
    "requesting_organization_ref": "org-ref-1f33697"
  },
  "data_scope": {
    "data_category": "customer_account_data",
    "subject_ref": "subject-ref-580ba34",
    "scope_description": "Incomplete deletion scenario — synthetic record for dataset testing purposes only.",
    "systems_in_scope": [
      "saas-app-core-01",
      "saas-app-support-01",
      "saas-app-billing-01"
    ]
  },
  "execution": {
    "execution_status": "PARTIAL",
    "executed_at": "2026-08-15T15:35:22Z",
    "execution_method_declaration": "Deletion/data-exit executed via standard operational workflow declaration (synthetic).",
    "systems_completed": [
      "saas-app-core-01"
    ],
    "systems_pending": [
      "saas-app-support-01",
      "saas-app-billing-01"
    ]
  },
  "residual_state": {
    "backup_state": "excluded from backup — primary system only",
    "residual_copies_declared": true,
    "retention_exception": "Residual copy identified in secondary storage tier (synthetic).",
    "legal_hold": false
  },
  "evidence_metadata": {
    "source_system_id": "saas-app-core-01",
    "responsible_party_reference": "party-ref-3226276",
    "recorded_at": "2026-08-25T12:41:31Z",
    "evidence_references": [
      "ticket-000199"
    ],
    "canonicalization_method": "der-ver-canonical-json-v0.1",
    "record_hash": "ef2858c0b6c7debcf4b9438407ec14df5a55b30ad8ec6c27282d43b3f1dae123"
  }
}
