{
  "record_id": "der-00153",
  "record_type": "DER",
  "schema_version": "0.1.0",
  "timestamp": "2026-08-25T17:24:19Z",
  "request_context": {
    "request_id": "req-00153",
    "request_type": "ACCOUNT_CLOSURE",
    "requested_at": "2026-07-19T10:57:03Z",
    "requesting_role": "compliance_operations",
    "requesting_organization_ref": "org-ref-1b57dc9"
  },
  "data_scope": {
    "data_category": "support_ticket_record",
    "subject_ref": "subject-ref-3d0ac92",
    "scope_description": "Account closure scenario — synthetic record for dataset testing purposes only.",
    "systems_in_scope": [
      "saas-app-core-01",
      "crm-system-eu-02",
      "crm-system-01"
    ]
  },
  "execution": {
    "execution_status": "PARTIAL",
    "executed_at": "2026-08-11T01:15:51Z",
    "execution_method_declaration": "Deletion/data-exit executed via standard operational workflow declaration (synthetic).",
    "systems_completed": [
      "saas-app-core-01"
    ],
    "systems_pending": [
      "crm-system-eu-02",
      "crm-system-01"
    ]
  },
  "residual_state": {
    "backup_state": "excluded from backup — primary system only",
    "residual_copies_declared": false,
    "legal_hold": false
  },
  "evidence_metadata": {
    "source_system_id": "saas-app-core-01",
    "responsible_party_reference": "party-ref-269380c",
    "recorded_at": "2026-08-25T17:24:19Z",
    "evidence_references": [
      "ticket-000153"
    ],
    "canonicalization_method": "der-ver-canonical-json-v0.1",
    "record_hash": "9d169198cbef125fe2a56aee78b208f37bf8ed399353249f22fcc6b2ef5024d3"
  }
}
