{
  "record_id": "der-00175",
  "record_type": "DER",
  "schema_version": "0.1.0",
  "timestamp": "2026-08-26T11:28:19Z",
  "request_context": {
    "request_id": "req-00175",
    "request_type": "CONTRACT_TERMINATION",
    "requested_at": "2026-06-25T10:15:41Z",
    "requesting_role": "account_owner",
    "requesting_organization_ref": "org-ref-190aaff"
  },
  "data_scope": {
    "data_category": "support_ticket_record",
    "subject_ref": "subject-ref-2cee90c",
    "scope_description": "Contract termination scenario — synthetic record for dataset testing purposes only.",
    "systems_in_scope": [
      "saas-app-billing-01",
      "saas-app-support-01",
      "saas-app-core-01"
    ],
    "processors_in_scope": [
      "subprocessor-payments-01",
      "subprocessor-analytics-01"
    ]
  },
  "execution": {
    "execution_status": "PARTIAL",
    "executed_at": "2026-08-20T17:59:05Z",
    "execution_method_declaration": "Deletion/data-exit executed via standard operational workflow declaration (synthetic).",
    "systems_completed": [
      "saas-app-billing-01"
    ],
    "systems_pending": [
      "saas-app-support-01",
      "saas-app-core-01"
    ]
  },
  "residual_state": {
    "backup_state": "backup purge pending next rotation cycle",
    "residual_copies_declared": true,
    "retention_exception": "Residual copy identified in secondary storage tier (synthetic).",
    "legal_hold": false,
    "subprocessor_status": "subprocessor deletion confirmed"
  },
  "evidence_metadata": {
    "source_system_id": "saas-app-billing-01",
    "responsible_party_reference": "party-ref-1fabfae",
    "recorded_at": "2026-08-26T11:28:19Z",
    "evidence_references": [
      "ticket-000175"
    ],
    "canonicalization_method": "der-ver-canonical-json-v0.1",
    "record_hash": "e8abed845eee85fb5f98013dd9b9db3b8cd7acd290221768fe4ad16ed167121e"
  }
}
