{
  "record_id": "der-00236",
  "record_type": "DER",
  "schema_version": "0.1.0",
  "timestamp": "2026-08-26T03:10:07Z",
  "request_context": {
    "request_id": "req-00236",
    "request_type": "ADMINISTRATIVE_DELETION",
    "requested_at": "2026-07-11T04:00:43Z",
    "requesting_role": "compliance_operations",
    "requesting_organization_ref": "org-ref-2cab72c"
  },
  "data_scope": {
    "data_category": "usage_analytics_record",
    "subject_ref": "subject-ref-56f5d47",
    "scope_description": "Deletion exception scenario — synthetic record for dataset testing purposes only.",
    "systems_in_scope": [
      "crm-system-eu-02",
      "crm-system-01",
      "analytics-platform-02"
    ]
  },
  "execution": {
    "execution_status": "EXCEPTION",
    "executed_at": "2026-08-14T15:22:02Z",
    "execution_method_declaration": "Deletion/data-exit executed via standard operational workflow declaration (synthetic).",
    "systems_completed": [
      "crm-system-eu-02"
    ],
    "systems_pending": [
      "crm-system-01",
      "analytics-platform-02"
    ]
  },
  "residual_state": {
    "backup_state": "included in standard 30-day backup rotation",
    "residual_copies_declared": false,
    "legal_hold": false
  },
  "evidence_metadata": {
    "source_system_id": "crm-system-eu-02",
    "responsible_party_reference": "party-ref-5a8e435",
    "recorded_at": "2026-08-26T03:10:07Z",
    "evidence_references": [
      "ticket-000236"
    ],
    "canonicalization_method": "der-ver-canonical-json-v0.1",
    "record_hash": "87e23cfa90769aa8f128aa0275cab66d5bbd45abab0fc61722d72f1b5863561b"
  }
}
