{
  "record_id": "der-00301",
  "record_type": "DER",
  "schema_version": "0.1.0",
  "timestamp": "2026-08-26T15:15:28Z",
  "request_context": {
    "request_id": "req-00301",
    "request_type": "CUSTOMER_OFFBOARDING",
    "requested_at": "2026-06-05T12:27:20Z",
    "requesting_role": "data_subject",
    "requesting_organization_ref": "org-ref-513801d"
  },
  "data_scope": {
    "data_category": "vendor_contract_record",
    "subject_ref": "subject-ref-38b38de",
    "scope_description": "Multi-system deletion scenario — synthetic record for dataset testing purposes only.",
    "systems_in_scope": [
      "saas-app-core-01",
      "marketing-platform-01"
    ],
    "processors_in_scope": [
      "subprocessor-email-01"
    ]
  },
  "execution": {
    "execution_status": "PENDING_SUBPROCESSOR",
    "executed_at": "2026-08-25T06:33:02Z",
    "execution_method_declaration": "Deletion/data-exit executed via standard operational workflow declaration (synthetic).",
    "systems_completed": [
      "saas-app-core-01"
    ],
    "systems_pending": [
      "marketing-platform-01"
    ]
  },
  "residual_state": {
    "backup_state": "excluded from backup — primary system only",
    "residual_copies_declared": false,
    "legal_hold": false,
    "subprocessor_status": "subprocessor deletion confirmed"
  },
  "evidence_metadata": {
    "source_system_id": "saas-app-core-01",
    "responsible_party_reference": "party-ref-977d08",
    "recorded_at": "2026-08-26T15:15:28Z",
    "evidence_references": [
      "ticket-000301"
    ],
    "canonicalization_method": "der-ver-canonical-json-v0.1",
    "record_hash": "068d1872716da902a1078b5627a2882b34bb22bd60e6d20a609a3c1c79807138"
  }
}
